{
  "schemaVersion": 2,
  "palettes": {
    "quarry.worker": {
      "dark": "#202840",
      "skin": "#e0a14c",
      "highlight": "#f2d18a",
      "cloth": "#547c83"
    },
    "quarry.ember": {
      "core": "#ffeb9a",
      "hot": "#ff9948",
      "edge": "#e9483b"
    },
    "quarry.talent": {
      "shadow": "#202840",
      "stone": "#547c83",
      "metal": "#a7bdad",
      "light": "#f2d18a",
      "ember": "#ff7139",
      "void": "#7e6ad6"
    }
  },
  "fragments": [
    {
      "id": "quarry.worker-body",
      "layers": [
        { "shape": "ellipse", "colorRole": "skin", "x": 8, "y": 5, "width": 5, "height": 5, "jitterPixels": 1 },
        { "shape": "rect", "colorRole": "cloth", "x": 6, "y": 10, "width": 9, "height": 10, "jitterPixels": 1 },
        { "shape": "rect", "colorRole": "dark", "x": 5, "y": 18, "width": 4, "height": 5 },
        { "shape": "rect", "colorRole": "dark", "x": 12, "y": 18, "width": 4, "height": 5 }
      ]
    },
    {
      "id": "quarry.ember-shape",
      "layers": [
        { "shape": "ellipse", "colorRole": "core", "x": 3, "y": 2, "width": 3, "height": 4, "jitterPixels": 1 },
        { "shape": "rect", "colorRole": "hot", "x": 1, "y": 4, "width": 6, "height": 4 },
        { "shape": "ellipse", "colorRole": "edge", "x": 2, "y": 7, "width": 4, "height": 3 }
      ]
    },
    {
      "id": "quarry.core-glyph",
      "layers": [
        { "shape": "rect", "colorRole": "shadow", "x": 4, "y": 4, "width": 8, "height": 8 },
        { "shape": "rect", "colorRole": "light", "x": 5, "y": 5, "width": 6, "height": 6 },
        { "shape": "rect", "colorRole": "ember", "x": 7, "y": 7, "width": 2, "height": 2 }
      ]
    },
    {
      "id": "quarry.relay-glyph",
      "layers": [
        { "shape": "rect", "colorRole": "shadow", "x": 2, "y": 6, "width": 12, "height": 4 },
        { "shape": "rect", "colorRole": "metal", "x": 3, "y": 7, "width": 10, "height": 2 },
        { "shape": "rect", "colorRole": "stone", "x": 6, "y": 3, "width": 4, "height": 10 },
        { "shape": "rect", "colorRole": "light", "x": 7, "y": 4, "width": 2, "height": 8 }
      ]
    },
    {
      "id": "quarry.overdrive-glyph",
      "layers": [
        { "shape": "ellipse", "colorRole": "shadow", "x": 2, "y": 2, "width": 12, "height": 12 },
        { "shape": "ellipse", "colorRole": "ember", "x": 4, "y": 4, "width": 8, "height": 8 },
        { "shape": "ellipse", "colorRole": "light", "x": 6, "y": 6, "width": 4, "height": 4 },
        { "shape": "rect", "colorRole": "light", "x": 7, "y": 0, "width": 2, "height": 3 },
        { "shape": "rect", "colorRole": "ember", "x": 7, "y": 13, "width": 2, "height": 3 }
      ]
    },
    {
      "id": "quarry.echo-glyph",
      "layers": [
        { "shape": "ellipse", "colorRole": "void", "x": 3, "y": 3, "width": 10, "height": 10 },
        { "shape": "ellipse", "colorRole": "shadow", "x": 5, "y": 5, "width": 6, "height": 6 },
        { "shape": "ellipse", "colorRole": "light", "x": 7, "y": 7, "width": 2, "height": 2 },
        { "shape": "line", "colorRole": "void", "x": 1, "y": 8, "width": 3, "height": 0 },
        { "shape": "line", "colorRole": "void", "x": 12, "y": 8, "width": 3, "height": 0 }
      ]
    },
    {
      "id": "quarry.temper-glyph",
      "layers": [
        { "shape": "rect", "colorRole": "shadow", "x": 2, "y": 5, "width": 12, "height": 8 },
        { "shape": "rect", "colorRole": "metal", "x": 3, "y": 6, "width": 10, "height": 5 },
        { "shape": "rect", "colorRole": "light", "x": 1, "y": 4, "width": 14, "height": 2 },
        { "shape": "rect", "colorRole": "stone", "x": 5, "y": 12, "width": 6, "height": 2 }
      ]
    },
    {
      "id": "quarry.cataclysm-glyph",
      "layers": [
        { "shape": "line", "colorRole": "ember", "x": 8, "y": 0, "width": 0, "height": 15 },
        { "shape": "line", "colorRole": "ember", "x": 0, "y": 8, "width": 15, "height": 0 },
        { "shape": "line", "colorRole": "light", "x": 3, "y": 3, "width": 10, "height": 10 },
        { "shape": "ellipse", "colorRole": "shadow", "x": 5, "y": 5, "width": 6, "height": 6 },
        { "shape": "ellipse", "colorRole": "void", "x": 7, "y": 7, "width": 2, "height": 2 }
      ]
    }
  ],
  "recipes": [
    {
      "id": "quarry.miner",
      "kind": "actor",
      "seed": 2048,
      "canvasWidth": 24,
      "canvasHeight": 24,
      "paletteId": "quarry.worker",
      "useFragments": ["quarry.worker-body"]
    },
    {
      "id": "quarry.ember-spark",
      "kind": "particle",
      "seed": 901,
      "canvasWidth": 10,
      "canvasHeight": 10,
      "paletteId": "quarry.ember",
      "useFragments": ["quarry.ember-shape"]
    },
    {
      "id": "quarry.core-icon",
      "kind": "prop",
      "seed": 1101,
      "canvasWidth": 16,
      "canvasHeight": 16,
      "paletteId": "quarry.talent",
      "useFragments": ["quarry.core-glyph"]
    },
    {
      "id": "quarry.relay-icon",
      "kind": "prop",
      "seed": 1102,
      "canvasWidth": 16,
      "canvasHeight": 16,
      "paletteId": "quarry.talent",
      "useFragments": ["quarry.relay-glyph"]
    },
    {
      "id": "quarry.overdrive-icon",
      "kind": "effect",
      "seed": 1103,
      "canvasWidth": 16,
      "canvasHeight": 16,
      "paletteId": "quarry.talent",
      "useFragments": ["quarry.overdrive-glyph"],
      "layers": [
        { "shape": "rect", "colorRole": "light", "x": 1, "y": 0, "width": 14, "height": 2, "state": "active" },
        { "shape": "rect", "colorRole": "light", "x": 1, "y": 14, "width": 14, "height": 2, "state": "active" },
        { "shape": "rect", "colorRole": "ember", "x": 0, "y": 1, "width": 2, "height": 14, "state": "active" },
        { "shape": "rect", "colorRole": "ember", "x": 14, "y": 1, "width": 2, "height": 14, "state": "active" }
      ]
    },
    {
      "id": "quarry.echo-icon",
      "kind": "effect",
      "seed": 1104,
      "canvasWidth": 16,
      "canvasHeight": 16,
      "paletteId": "quarry.talent",
      "useFragments": ["quarry.echo-glyph"]
    },
    {
      "id": "quarry.temper-icon",
      "kind": "prop",
      "seed": 1105,
      "canvasWidth": 16,
      "canvasHeight": 16,
      "paletteId": "quarry.talent",
      "useFragments": ["quarry.temper-glyph"]
    },
    {
      "id": "quarry.cataclysm-icon",
      "kind": "effect",
      "seed": 1106,
      "canvasWidth": 16,
      "canvasHeight": 16,
      "paletteId": "quarry.talent",
      "useFragments": ["quarry.cataclysm-glyph"]
    }
  ]
}
